{
  "formatVersion": "1",
  "header": {
    "description": "Test Object Cloud",
    "originalLanguage": "en",
    "abapLanguageVersion": "cloudDevelopment"
  },
  "generalInformation": {
    "objectClass": "CPAE"
  },
  "authorizationFields": [
    {
      "authorizationField": "ACTVT",
      "isActivityField": true
    }
  ],
  "permittedActivities": [
    {
      "activity": "03",
      "accessCategory": "read"
    }
  ],
  "objectAttributes": {
    "criticality": "notCritical"
  },
  "classForCdsBdef": {
    "usageInOwnAuthContext": "allowed",
    "usageInPrivilegedBdefMode": "allowed"
  }
}
